{
  "id": "phrases-greetings",
  "title": "Basic Greetings",
  "description": "Essential greetings and common phrases in Dzardzongke",
  "cards": [
    { "id": "g1", "front": "བཀྲ་ཤིས་བདེ་ལེགས།", "back": "Hello (formal)" },
    { "id": "g2", "front": "ག་ལེར་ཕེབས།", "back": "Goodbye" },
    { "id": "g3", "front": "ཐུགས་རྗེ་ཆེ།", "back": "Thank you" },
    { "id": "g4", "front": "དགོངས་པ་མ་ཚོམ།", "back": "Excuse me" },
    { "id": "g5", "front": "ཁྱེད་རང་བདེ་པོ་ཡིན་པས།", "back": "How are you?" },
    { "id": "g6", "front": "ང་བདེ་པོ་ཡིན།", "back": "I am fine" },
    { "id": "g7", "front": "དགོངས་དག", "back": "Sorry" },
    { "id": "g8", "front": "ཁྱེད་རང་གི་མཚན་ལ་ག་རེ་ཞུ་གི་ཡོད།", "back": "What is your name?" },
    { "id": "g9", "front": "ངའི་མིང་ལ་___ཟེར་གྱི་ཡོད།", "back": "My name is ___" },
    { "id": "g10", "front": "དགའ་པོ་བྱུང་།", "back": "Nice to meet you" }
  ]
}
